Company Name,Website URL,Country,Primary Business Type,Current Metal Capabilities Mentioned,Hospitality Focus,Contact Email,Notes/Gap
Otypo,https://otypo.it,Italy,Signage & Nameplate Manufacturer,Brass (ottone),Strong - hotel signage specialism,N/A,Family business 60+ years; online custom plate ordering; strong hospitality sector
Idea Pubblicità,https://www.ideapubblicita.it,Italy,Signage & Advertising,Metals including brass,Medium - hotel sign projects,N/A,Since 1988 in Forlì; offers certified energy labels; full project management
Fas Italia (Forniture Alberghiere),https://www.forniture-alberghiere.biz,Italy,Hotel Supplies & Signage,Brass (ottone),Strong - dedicated hotel signage,N/A,Florence-based; comprehensive hotel supplier; brass plates for rooms/common areas
Incisoria F.lli Barosi,https://incisoriabarosi.it,Italy,Custom Engraving,Brass; plexiglass; metal,Strong - hotels and restaurants,N/A,Artisan family business in Riccione; CNC and laser cutting; plates for hotels/restaurants
Chimimetal,https://www.chimimetal.com,Italy,Chemical Photolithography,Ottone; all metals; precision etching,Low - industrial focus,N/A,Leader in chemical etching since 1997; precision work but primarily automotive/industrial
Insegne Italia,https://www.insegneitalia.com,Italy,Signage Manufacturer,Multiple metals,Medium - general signage,N/A,National presence; Turin-based; luminous signs and architectural
